{
  "schemaVersion": "modular-home-unreal-poc-v1",
  "experience": "modular-home-visualizer",
  "sessionId": "poc-session-local-001",
  "streamerId": "home-compact-timber-40-premium-poc",
  "product": {
    "productId": "compact-timber-40",
    "name": "Compact Timber 40",
    "templateId": "compactTimber40",
    "floorAreaM2": 40,
    "footprint": {
      "widthM": 8,
      "lengthM": 5
    },
    "ceilingHeightM": 2.6
  },
  "config": {
    "facade": "naturalTimber",
    "roof": "pitched",
    "terrace": "frontDeck",
    "finishLevel": "premium",
    "windowPackage": "standardWindows",
    "doorPackage": "standardEntry"
  },
  "modules": [
    {
      "instanceId": "compact-40-living-01",
      "moduleId": "compact-living-module",
      "quantity": 1,
      "role": "Living and kitchen module",
      "positionHint": "front living/kitchen zone",
      "productionGroup": "primary-shell"
    },
    {
      "instanceId": "compact-40-bedroom-01",
      "moduleId": "compact-bedroom-module",
      "quantity": 1,
      "role": "Bedroom module",
      "positionHint": "rear private zone",
      "productionGroup": "primary-shell"
    },
    {
      "instanceId": "compact-40-bathroom-core-01",
      "moduleId": "bathroom-core-module",
      "quantity": 1,
      "role": "Bathroom core",
      "positionHint": "rear service corner",
      "productionGroup": "service-core"
    }
  ],
  "materials": {
    "facadeMaterialId": "natural-timber-siding",
    "roofMaterialId": "metal-roof",
    "interiorMaterialIds": [
      "interior-plywood-finish",
      "bathroom-wet-core",
      "premium-furniture-package"
    ],
    "terraceMaterialId": "timber-terrace-deck",
    "glassMaterialId": "clear-low-iron-glass"
  },
  "variants": {
    "facadeVariant": "naturalTimber",
    "roofVariant": "pitched",
    "terraceVariant": "frontDeck",
    "interiorPackage": "premium",
    "windowVariant": "standardWindows",
    "doorVariant": "standardEntry"
  },
  "camera": {
    "initialPreset": "walkthrough-entry",
    "allowedPresets": [
      "exterior-hero",
      "walkthrough-entry",
      "living-kitchen",
      "bedroom",
      "bathroom-core",
      "terrace"
    ]
  },
  "quoteContext": {
    "currency": "EUR",
    "estimatedTotal": 94600,
    "finalQuote": false,
    "disclaimer": "Estimate only; final quote requires site, transport and engineering review."
  },
  "safety": {
    "piiIncluded": false,
    "uploadedUserAssets": false,
    "finalQuote": false,
    "productionEnabled": false
  }
}
